dialog_id	en	filename	duration	postpause	speaker_id
s7_5_key_altobj	Or, first lock the guards inside to make sure they didn’t try to stop you.	s7_5_key_01	4	1	death
s7_5_lockedup	All the doors were locked tight with the master key.	s7_5_lockedup_00	4	1	death
s7_5_lockedup	Getting away would be much easier now.	s7_5_lockedup_01	4	1	death
s7_5_florencereleased	At last, Florence was free.	s7_5_florencereleased	4	1	death
s7_5_loanshark	Vengeance was yours.	s7_5_loanshark	4	1	death
s7_5_killall	Now, onto the guards.	s7_5_killall	4	1	death
s7_5_killfree	Now all you had to do was dispatch the guards outside.	s7_5_killfree	4	1	death
s7_5_end	Florence was free and there was no one left to pursue you.	s7_5_end	4	1	death
s7_jinx	Your father was under a dark cloud and not a day would go by without some sort of mishap.	s7_jinx	4	1	death
s7_fatherleaves	You and Florence were on your own now. At least you still had a home.	s7_fatherleaves	4	1	death
s7_5alt_start	You came to clean up the chaos left in the wake of the outlaw leader’s demise.	s7_5alt_start_00	4	1	death
s7_5alt_start	But it was quiet. Too quiet...	s7_5alt_start_01	4	1	death
s7_5alt_ambush	It was an ambush. They knew you were coming.	s7_5alt_ambush	4	1	death
s7_5alt_turn	Your enemies met their end and their numbers gradually dwindled.	s7_5alt_turn	4	1	death
s7_5alt_boss	Finally, you took down the most vicious among them.	s7_5alt_boss	4	1	death
s7_5alt_end	With the worst of the lot gone, the town now had a chance to find some semblance of normalcy.	s7_5alt_end	4	1	death
s7_siege	A gang of desperadoes had taken over your homestead.	s7_siege_00	4	1	death
s7_siege	Was there no end to the tyranny of evil men?	s7_siege_01	4	1	death
s7_6_start	You would fight for your home and take back what was yours.	s7_6_start	4	1	death
s7_6_startalt	The tunnel you used was mighty useful and led you all the way into the house.	s7_6_startalt	4	1	death
s7_6_turn	What you didn’t know at the time was that those hired thugs worked for the railroad.	s7_6_turn_00	4	1	death
s7_6_turn	The corrupt local government deeded them your property, claiming the right of eminent domain.	s7_6_turn_01	4	1	death
s7_6_turn	Making the house you were defending no longer yours.	s7_6_turn_02	4	1	death
s7_6_turn	Every man you killed raised the reward on your head a little higher…	s7_6_turn_03	4	1	death
s7_6_turn	Because now you were a wanted man. An outlaw.	s7_6_turn_04	4	1	death
s7_finale	When every last thug was silenced, the truth of your situation finally hit home.	s7_finale_00	4	1	death
s7_finale	You had to run.	s7_finale_01	4	1	death
	Scenario 8: A Matter of Time				
s8_t1_hanging	Two men would save Cassandra and set her free.	s8_t1_hanging_00	4	1	death
s8_t1_hanging	But first they needed to distract the mob.	s8_t1_hanging_01	4	1	death
s8_t1_marshaldead	Before the life left the hangman’s eyes, Cassandra had already loosened her binds.	s8_t1_marshaldead	5	1	death
s8_t1_crowdrouted	Cassandra didn’t know the names of her saviors.	s8_t1_crowdrouted_00	4	1	death
s8_t1_crowdrouted	But there was no time for introductions.	s8_t1_crowdrouted_01	3	1	death
s8_t1_crowdrouted	The men who wanted her dead needed to be dealt with.	s8_t1_crowdrouted_02	5	1	death
s8_t1_crowdrouted	Neither they nor their carrier pigeons could leave that town alive.	s8_t1_crowdrouted_03	4	1	death
s8_t1_frontattack	Cassandra thought the front approach looked risky.	s8_t1_frontattack_00	4	1	death
s8_t1_frontattack	She wondered if there was another way in.	s8_t1_frontattack_01	4	1	death
s8_t1_doorlocked	There was a backdoor. But it required a key.	s8_t1_doorlocked_00	4	1	death
s8_t1_doorlocked_2	The key had to be somewhere nearby.	s8_t1_doorlocked_01	4	1	death
s8_t1_nightmare	The rurales turned out to be something more than just corrupt lawmen.	s8_t1_nightmare	5	1	death
s8_t1_pigeonsdead	The birds were no more. For the time being, Cassandra was safe.	s8_t1_pigeonsdead	5	1	death
s8_t1_pigeonsdeadbutnotdemons	The birds were no more, but the Inquisitor's men still posed a threat.	s8_t1_pigeonsdeadbutnotdemons	5	1	death
s8_t1_alldead	With their adversaries dead, there was no one left to bear witness to what happened that day.	s8_t1_alldead	5	1	death
s8_str_closeshave	The two men introduced themselves as servants of the Protector.	s8_str_closeshave_00	3	1	death
s8_str_closeshave	Their employer was a friend of the order Cassandra once belonged to.	s8_str_closeshave_01	4	1	death
s8_str_closeshave	The Protector offered shelter and whatever help Cassandra required.	s8_str_closeshave_02	3	1	death
s8_str_closeshave	She didn't want shelter. She wanted to rid herself of her "gift".	s8_str_closeshave_03	4	1	death
s8_str_closeshave	Hardin assured her the Protector could help her with that as well.	s8_str_closeshave_04	3	1	death
s8_str_closeshave	But to reach him, they would need to cross a river and sail across a bay.	s8_str_closeshave_05	4	1	death
s8_t3_intro	The Inquisitor's men had destroyed their means of escape.	s8_t3_intro_00	4	1	death
s8_t3_intro	Their only hope was to seize an enemy boat.	s8_t3_intro_01	4	1	death
s8_t3_intro	And eliminate the other enemy vessel, lest they give chase.	s8_t3_intro_02	4	0	death
s8_t3_intro_supplies	The supplies from the island could be useful. But freedom came first.	s8_t3_intro_supplies	4	1	death
s8_t3_bridge	Lifting the bridge trapped the enemies on the other side.	s8_t3_bridge_00	4	1	death
s8_t3_supplieslost	But it also separated Cassandra and her saviors from those supplies.	s8_t3_supplieslost	4	1	death
s8_t3_federaledead	Joaquim Perez would never dog Cassandra again.	s8_t3_federaledead_00	4	1	death
s8_t3_firstboat	The first boat drifted away from the island. They needed to reach that last one.	s8_t3_firstboat	4	1	death
s8_t3_secondboat_enemies	The final boat was within reach, but their enemies were tenacious.	s8_t3_secondboat_enemies	4	1	death
s8_t3_secondboat	The final boat was within reach and any stragglers would be left behind.	s8_t3_secondboat	4	1	death
s8_str_postlake	Ricardo Lafórtuna was the Protector's most dangerous rival.	s8_str_postlake_00	4	1	death
s8_str_postlake	His fleet blockaded their ultimate destination.	s8_str_postlake_01	4	1	death
s8_str_postlake	Any vessel that attempted to get by would be blasted out of the water.	s8_str_postlake_02	4	1	death
s8_str_postlake	Cassandra wondered if Lafórtuna could be persuaded to let them pass.	s8_str_postlake_03	4	1	death
s8_str_postlake	Hardin told her about a grand poker tournament that Lafórtuna was hosting.	s8_str_postlake_04	4	1	death
s8_str_postlake	Joining the game would require a 25000 peso buy-in.	s8_str_postlake_05	4	1	death
s8_str_25k	Now that Cassandra had the necessary twenty-five thousand pesos,	s8_str_25k_00	4	1	death
s8_str_25k	She was ready to conquer Lafórtuna's grand tournament.	s8_str_25k_01	4	1	death
s8_str_mercs	Lafórtuna's mercenary force had to be prevented from reaching the bay.	s8_str_mercs_00	4	1	death
s8_str_mercs	Hardin suggested they blow up the train.	s8_str_mercs_01	4	1	death
s8_str_mercs	Cassandra concurred. They just needed to procure the explosives.	s8_str_mercs_02	4	1	death
s8_t2_intro	Survivors crawled from the ruins of the train wreck.	s8_t2_intro_00	4	1	death
s8_t2_intro	The team readied their weapons with killing intent.	s8_t2_intro_01	4	1	death
s8_t2_alldead	Cassandra looked relieved when the last mercenary was finally dispatched.	s8_t2_alldead	4	1	death
s8_str_posttrain	With the mercenary force gone, Lafórtuna would likely accept Cassandra's offer.	s8_str_posttrain	4	1	death
s8_str_ontotheisland	At long last, Cassandra set sail for the Protector's island.	s8_str_ontotheisland	4	1	death
s8_t4_intro	Hardin and the Protector both proved to be traitors.	s8_t4_intro_00	4	1	death
s8_t4_intro	The latter wanted to experiment on Cassandra to see what made her tick.	s8_t4_intro_01	4	1	death
s8_t4_breakout	The lock on her cell door was easily picked with a hairpin.	s8_t4_breakout_00	4	1	death
s8_t4_breakout	But the guards were on high alert.	s8_t4_breakout_01	4	1	death
s8_t4_breakout	If they saw her loose, they would shoot to kill.	s8_t4_breakout_02	4	1	death
s8_t4_freecompanions	Cassandra's companions were here as well. She could free them.	s8_t4_freecompanions	4	1	death
s8_t4_cellkeys	Cassandra could now free her companions.	s8_t4_cellkeys	4	1	death
s8_t4_federale	Joaquim Perez was also held prisoner by the Protector.	s8_t4_federale_00	4	1	death
s8_t4_federale	He promised to help her, if Cassandra let him go.	s8_t4_federale_01	4	1	death
s8_t4_federale	She wasn't sure she could trust him.	s8_t4_federale_02	4	1	death
s8_t4_betrayal	Perez called Cassandra on her ruthless killings, as he drew his gun against her.	s8_t4_betrayal	4	1	death
s8_t4_machine	Cassandra couldn’t help but notice all the Protector’s sophisticated machinery.	s8_t4_machine	4	1	death
s8_t4_meetprotector	The Protector claimed he was the only one who could lift Cassandra’s curse.	s8_t4_meetprotector_00	4	1	death
s8_t4_meetprotector	If she killed him, she would lose the opportunity.	s8_t4_meetprotector_01	4	1	death
s8_t4_meetprotector	She told him she would take her chances.	s8_t4_meetprotector_02	4	1	death
s8_t4_protectordead	The Protector was gone and so was his knowledge of how to use that machine.	s8_t4_protectordead_00	4	1	death
s8_t4_protectordead_2	But Cassandra wasn’t ready to give up that easily.	s8_t4_protectordead_01	4	1	death
s8_t4_protectordead_2	She had the Protector’s notes and documents, and all the time in the world.	s8_t4_protectordead_02	4	1	death
s8_t4_postfade	Several days later, Cassandra decided she was ready.	s8_t4_postfade_00	4	1	death
s8_t4_postfade	Nightmares flooded her consciousness as exhaustion took its toll.	s8_t4_postfade_01	4	1	death
s8_t4_specimens	The room contained not only machinery, but also the Protector's failed human experiments.	s8_t4_specimens	4	1	death
s8_t4_usewithenemies	The operation was quick and excruciating.	s8_t4_usewithenemies_00	4	1	death
s8_t4_usewithenemies	But from the pain, a new perception emerged.	s8_t4_usewithenemies_01	4	1	death
s8_t4_usewithenemies	She was finally free.	s8_t4_usewithenemies_02	4	1	death
s8_t4_removepower	Cassandra flipped the last lever and closed her eyes in anticipation.	s8_t4_removepower_00	4	1	death
s8_t4_removepower2	A short, but excruciating moment later her curse was lifted.	s8_t4_removepower_01	4	1	death
s8_t4_removepower3	She was finally free.	s8_t4_removepower_02	4	1	death