text_id	en	format
s2_outcast_desc_indian_village_paid	A tribesman named Gomda was the Order's eyes and ears among the natives.<br><br>Having never dealt with Dohosan's people before, Cervantes asked him what would make his people turn on one another. Dohosan handed Cervantes a pendant. It was one of several items he had stolen from his tribe when he left. He had hoped to trade these items for money. Cervantes figured out the rest.	
s2_outcast_desc_smuggler_cave_unpaid	South of the village there was a cave by the river where white smugglers traded forbidden goods with both Europeans and natives.<br>One of the smugglers was a member of the Order. Dohosan would identify him in exchange for money.	
s2_outcast_desc_smuggler_cave_paid	The Order member's name was Jack Weinberg. He could be found in the smugglers' cave.	
s2_outcast_desc_tradepost_unpaid	One Order member worked at the nearby trading post.	
s2_outcast_desc_tradepost_paid	Dohosan revealed that the Order member at the trading post was named Roger Matthews.	
s2_outcast_report	Cervantes was one cipher piece short of his goal. <br><br>He returned to Dohosan and in his most intimidating voice, demanded that the outcast reveal the final member of the Order. Dohosan tried to resist, but eventually he confessed. It was the shaman. He lived in isolation to the West of the village. Dohosan warned the Inquisitor gravely, though. The man's wielded formidable mystical powers.	
s2_outcast_charm	Dohosan hinted that he was in possession of a charm that would protect the wearer against the shaman's spiritual powers. He had it hidden nearby and said he was willing to sell it to the Inquisitor.<br><br>His price was $150.	
s2_outcast_charm_bought	Greedily, Dohosan took the money and told Cervantes where he could find the charm. It was hidden under a nearby rock. While the Inquisitor fetched the item, Dohosan packed up his belongings and set out northwards, his head lowered in shame.	
s2_indian_village_title	Native Village	
s2_indian_village_desc	It was a peaceful, seemingly idyllic village. The natives tolerated the presence of the white folk, but watched their every step. Cervantes felt they would not hesitate to strike them down should the need arise.	
s2_indian_village_kill_not_ready	Cervantes had not yet made preparations at the burial grounds to frame Gomda.	
s2_indian_village_kill_1	Cervantes asked to see Chief Setangya and was granted an audience. Setangya listened patiently as the Inquisitor spun his tale. Cervantes told how he came upon one of Setangya's tribesmen desecrating native graves.<br><br>Setangya was enraged by these allegations, and sent several men to inspect the burial grounds. When they returned, they confirmed the claims Cervantes had made. Worse still, they found Gomda's pendant there. There could be little doubt it had been his doing.	
s2_indian_village_kill_2	Setangya wanted to exile Gomda, but Cervantes convinced him the only true punishment for this heinous crime was immolation.<br><br>Gomda remained proud and solemn as he burned, staring at Cervantes in silence until his flesh was blackened and he saw no more. When the cipher piece fell from his belly, Cervantes said it had driven Gomda to commit the atrocities. He picked it up as they recoiled, promising the natives he would destroy it for them. As he rode away, the natives thanked Cervantes with prodigious prostrations and gestures of respect.	
s2_indian_village_slaughtered_1	There was no way Cervantes could kill all the natives himself. And tricking the tribesmen into turning on one another seemed unlikely.<br><br>There was a force, however, that would be both willing and capable of slaughtering them all.	
s2_indian_village_slaughtered_2	The tribe was no more. When Cervantes arrived at the scene, Captain Alexis handed him the cipher piece without saying a word.<br><br>He noted that Indian-crafted goods would be hard to obtain from now on.	
s2_fort_title	Fort Brice	
s2_fort_desc	Most of the cavalrymen were relaxing, playing cards or napping in the corner. Captain Michael Alexis was very hospitable to the members of the clergy such as Cervantes.	
s2_fort_slaughter	When Cervantes told Captain Alexis that the Indians were preparing to attack the fort, he ordered his troops to prepare for a preemptive strike.<br><br>Cervantes barely managed to tell Alexis to keep his eyes open for a strange metallic piece before the cavalry rode off.	
s2_burial_grounds_title	Indian Burial Grounds	
s2_burial_grounds_desc	The burial grounds were a large field of graves with a magnificent mystical tree at its center. Tranquility hung like mist in the air.	
s2_burial_grounds_desecrated	Aiza was reluctant to desecrate the graves, but sly Cervantes convinced her that since they were pagan graves, the normal rules did not apply.<br><br>After several hours, they had dug up most of the graves, collecting many valuables in the process. Cervantes then dropped the locket in a slightly out of the way spot as though it had accidentally been dropped there.	
s2_shaman_title	The Shaman's Tent	
s2_shaman_desc	The Shaman lived in a tipi, as did the rest of the natives. His, however, was notably larger with intimidating decorations. Cervantes swore he felt a force eminating from within. The shaman would be expecting them.	
s2_shaman_kill_1	When they entered, the shaman was kneeling on the ground with his back turned to them. Without turning, he asked Aiza in broken English whether she was aware that her "friend" was in fact a servant of the evil spirit Christians called "the Devil."<br><br>Enraged, Cervantes approached the shaman, dagger in hand, but the Indian quickly turned and blew a white powder into his face. Cervantes felt immediately weak and gloomy.	
s2_shaman_kill_1_charm	When they entered, the shaman was kneeling on the ground with his back turned to them. Without turning, he asked Aiza in broken English whether she was aware that her "friend" was in fact a servant of the evil spirit Christians called "the Devil."<br><br>Enraged, Cervantes approached the shaman, dagger in hand, but the Indian quickly turned and blew a white powder into his face. Protected by Dohosan's protection charm, however, the powder had no effect on Cervantes.	
s2_shaman_kill_2	Cervantes, enraged, stabbed the man a dozen times and tore the cipher piece out of his chest.<br><br>When he emerged from the tipi, Aiza was gone. But what did that matter? The last cipher piece was in his possession. It was time to pay Raum a visit.<br><br>And then, DeLear.	
s2_cave_title	Cave	
s2_cave_desc	Beyond the trapdoor, a tunnel led into the hill and opened into the smugglers' cave. The place was an underground market, where several merchants had fancy stands. And enough muscle to guarantee order in a place that operated completely outside the law.<br><br>For a secretive outlaw joint, it was clean, well-run and the the clientele were diverse.	
s2_cave_killed	Cervantes asked the crowd in the cave if they were aware of the Internal Revenue Service. When the indignant hubbub died down, he said he was only asking because Jack Weinberg was a known spy for the agency.<br><br>Within seconds, Weinberg had been stabbed, clubbed in the head, and shot. The Inquisitor mimed giving Weinberg last rites as a pretense to retrieve the cipher piece from his dead body.	
s2_cave_salesman_intro	One of the merchants approached Cervantes, introducing himself as merchant of miracle potions, but also one who could spot a true visionary.<br><br>He said he'd been watching the Inquisitor and believed that by joining forces with him he could gain more than just corporeal riches. He sought immortality. Cervantes assured him he was making the right choice and accepted him into the posse.	
s2_cave_slaughtered	Cervantes and his compatriots collected dry wood and grass and built a bonfire just beyond the trap door. Cervantes lit it, then closed the trapdoor and blocked it with rocks.<br><br>As acrid smoke filled the passages below and the screams of the victims wafted up, Cervantes sat contemplatively, smoking. Once the screams died down, they removed the rocks, vented the chamber, and began slicing open bodies until they found the cipher piece.	
s2_tradepost_title	Jackson's Trading Post	
s2_tradepost_desc	Paul Jackson's Trading Post was a popular store in the area, frequented by both white folk and natives. It also sheltered a member of the Order.	
s2_tradepost_killed	Accusing Roger Matthews of smuggling goods to the Indians was all it took for the crowd to hang him from a pole.<br><br>Still he did not succumb, and hung there, gasping for breath and flailing his limbs pitifully. Cervantes did not wait until he died to cut the cipher piece out of his body to the cheers of the bloodthirsty crowd.	
s2_tradepost_slaughtered	Cervantes spread rumors around the crowd that the proprietors had been fencing goods taken in Indian attacks back to the people who had been stolen from. When he accused the vendors openly, a lynch mob formed, which pushed the staff to the ground and stomped the life out of them.<br><br>When their blood lust had dissapated and they dispersed, Cervantes searched through the bloody, misshapen remains to find another cipher piece.	
s2_outlawjoint_title	The Drunken Boar	
s2_outlawjoint_desc	The Drunken Boar was a cutthroat saloon, frequented by some of the nastiest men in the West.<br><br>Among all the scum, one man in caught Cervantes' attention. He was a slick, quiet fellow with an air of danger. Word had it he was Chip Hinshaw, the sharpest shot in 3 counties.	
s2_outlawjoint_hire_cheap	Cervantes used his sweetest talk, including assurances that he would be doing God's work, which meant a secure spot in Heaven.<br><br>Hinshaw interrupted him to name his price: $100.	
s2_outlawjoint_hire_expensive	Cervantes used his sweetest talk, including assurances that he would be doing God's work, which meant a secure spot in Heaven.<br><br>Hinshaw interrupted him, stating bluntly that he knew Cervantes burned down the brothel. It had been his favorite.<br><br>His little stunt would cost Cervantes extra. Hinshaw named his price, $250.	
s2_outlawjoint_hired	Hinshaw finished his drink, slammed the glass on the bar and accepted the deal.	
	Part 4: Finale	
s2_altar_final	While calm during their earlier meetings, Raum was visibly agitated when Cervantes returned to tell him the cipher was complete. Now they could use it to locate the Sanctuary, acquire the meteor and kill DeLear, its protector.<br><br>For reasons only known to himself, the normally dextrous Raum tipped over his cauldron before they left to search for the sanctuary.	
s2_sanctuary_title	The Sanctuary	
s2_sanctuary_desc	The magnificent villa was fortified and would require great force to capture. It didn't look like a hiding place for a mystical object, but according to the cipher, this was the fabled Sanctuary that DeLear had built.<br><br>They were certain DeLear was there, this time without the protection of his clairvoyant. That did not mean that he wasn't still a force to be reckoned with. If they were to make any last preparations, now was the time.	
s2_devil_appearance	They were closing in on the Sanctuary, when the Stranger appeared. Cervantes kneeled.<br><br>The Stranger said he was pleased with the death and destruction Cervantes had caused. As a reward, he had decided to give the Inquisitor nothing less than a gun forged in the fires of Hell. The Inquisitor thanked his master, then continued his quest with renewed determination.	
	ACTIONS / CHOICES	
s2_slaughter	They let the Devil sort 'em out.	g
s2_kill	Using the information they had, they only killed the Order member.	g
s2_shop	Cervantes looked at the wares.	b
	Part 1: Raum	
s2_altar_info_docks	The one at the docks	i
s2_altar_pay_docks	Cervantes gave Raum the missing ingredients ([%0])	p2liquoir
s2_altar_info_trappers	The one at the trappers' camp	i
s2_altar_pay_trappers	Cervantes handed Raum the ingredients ([%0])	p5dried_meat
s2_altar_info_farm	The one at the the farm	i
s2_altar_pay_farm	Cervantes handed Raum the item ([%0])	p1rabbit_foot
s2_altar_pay_church	Cervantes handed Raum what he asked for ([%0])	p2opium
s2_doctor_break_in	Cervantes forced his way into the house	g
s2_organize_mob	Cervantes organized a mob	g
s2_church_sneakattack	They attacked using the secret tunnel for a tactical advantage	t
s2_church_attack	They launched a frontal assault at the church	t
s2_doctor_heal	They had the doctor take care of the posse ([%0])	p300cash
s2_doctor_heal_slaughter	Reluctantly the doctor agreed to patch up the posse ([%0])	p500cash
	Part 2: Suit	
s2_opium_den_info_mine	The one at the mine	i
s2_opium_den_pay_mine	Cervantes paid for additional information ([%0])	p200cash
s2_opium_den_info_brothel	The one at the brothel	i
s2_opium_den_pay_brothel	Cervantes paid for additional information ([%0])	p200cash
s2_opium_den_info_saloon	The one at the saloon	i
s2_opium_den_pay_saloon	Cervantes paid for additional information ([%0])	p200cash
s2_opium_den_info_distillery	The one at the distillery	i
s2_opium_den_pay_distillery	Cervantes paid for additional information ([%0])	p200cash
s2_mine_attack	They attacked the mine	t
	Part 3: Outcast	
s2_outcast_info_indian_village	The one at the Indian Village	i
s2_outcast_pay_indian_village	Cervantes paid for additional information ([%0])	p200cash
s2_outcast_info_smuggler_cave	The one at the Smuggler Cave	i
s2_outcast_pay_smuggler_cave	Cervantes paid for additional information ([%0])	p200cash
s2_outcast_info_tradepost	The one at the Tradepost	i
s2_outcast_pay_tradepost	Cervantes paid for additional information ([%0])	p200cash
s2_cavalry_attack_prepare	Talk the Cavalry into attacking the Indians	g
s2_cavalry_trade	Cervantes looked at the wares	t
s2_cavalry_heal	They had the cavalry's medic patch them up ([%0])	p400cash
s2_burial_grounds_frame	They raided the graves and placed the locket	g
s2_buy_charm	Cervantes bought the charm ([%0])	p150cash
s2_engage_shaman	They engaged the Shaman	g
s2_outlawjoint_approach_poncho	Cervantes approached the man	n
s2_outlawjoint_pay_poncho_cheap	Cervantes handed over the money ([%0])	p100cash
s2_outlawjoint_pay_poncho_expensive	Cervantes handed over the money ([%0])	p250cash
	Part 4: Finale	
s2_attack_sanctuary	They attacked the Sanctuary	t
	Additional texts	
s2_slaughter_reward	Cervantes looted what was left after the chaos.	
s2_kill_reward	The people rewarded Cervantes for protecting them.	
s2_heal_inquisitor	Gabriel de Cervantes was healed ($[%0])	p25cash
s2_heal_el_federale	Joaquim Perez was healed ($[%0])	p25cash
s2_heal_nun	Sister Aiza was healed ($[%0])	p25cash
s2_heal_cassandra	Cassandra was healed ($[%0])	p25cash
s2_heal_devil_worshipper	Bathym Raum was healed ($[%0])	p25cash
s2_heal_poncho	Chip was healed ($[%0])	p25cash
s2_heal_salesman	Dave Oshry was healed ($[%0])	p25cash
s2_heal_inquisitor_slaughter	Gabriel de Cervantes was healed ($[%0])	p50cash
s2_heal_el_federale_slaughter	Joaquim Perez was healed ($[%0])	p50cash
s2_heal_nun_slaughter	Sister Aiza was healed ($[%0])	p50cash
s2_heal_cassandra_slaughter	Cassandra was healed ($[%0])	p50cash
s2_heal_devil_worshipper_slaughter	Bathym Raum was healed ($[%0])	p50cash
s2_heal_poncho_slaughter	Chip was healed ($[%0])	p50cash
s2_heal_salesman_slaughter	Dave Oshry was healed ($[%0])	p50cash
s2_demonprince	Demon Prince	
s2_river_shop_name	Wretchport Market	