text_id	en	format
s5_l8_mine_desc	Solomon determined the mine was still rich in resources. It had been abandoned after the madmen had damaged the support beams.<br><br>Some gold veins remained exposed, though. It was possible to mine them, but only at the risk of collapsing the mine entirely. Solomon was confident his Engineering expertise would help with extraction, however.	
s5_l8_r_a	They began the mining process.	g
s5_l8_a	Solomon fixed the elevator and the drill. Unfortunately, the mine collapsed after only a handful of transports.	
s5_l12_house_of_mad	Large House	
s5_l12_house_of_mad_desc	Solomon arrived at a dilapidated cottage inhabited by the Thurner family, a strange group that laughed at even the most solemn things.<br><br>They invited him for dinner.	
s5_l12_r_intimidate	Solomon pointed his gun at them and ordered them to hand over their valuables.	g
s5_l12_intimidate	Solomon intimidated the Thurners, taking everything of worth that they had.<br><br>They began crying like children and pouted, refusing to talk to him again.	
s5_l12_r_eat	Solomon decided to accept their offer.	g
s5_l12_eat	He broke bread with the Thurners, but felt sick soon afterwards. Hallucinations and depression struck his mind with a punch.	
s5_l12_eat2	One of the Pinkertons accepted their offer, but fell sick soon afterwards. Later, tormented by horrible waking nightmare, he perished.	
s5_l12_visited	The cottage stood abandoned.	
s5_l12_r_confront	Solomon confronted the family.	g
s5_l12_confront	They begged for their lives and gave him a blueprint signed by Trumercliff.	
s5_l12_r_kill	Solomon killed them and took their valuables.	g
s5_l12_kill	Solomon killed the crazy family and took everything of worth.	
s5_l13_battleground	Gangs' Battleground	
s5_l13_battleground_desc	A pile of dead bodies sporting sheriff's deputy badges lay in the field.<br><br>Each also carried a letter instructing him to kill any criminals he found in the name of his Master. The letters were signed by sheriff Turner. There were no signs of any victims other than the deputies.	
s5_l13_battleground_r_a	Solomon only checked the bodies on the edge of the battleground.	g
s5_l13_battleground_r_b	Solomon thoroughly searched the whole battleground, despite the risk that it could negatively impact his psyche.	g
s5_l13_battleground_a	He managed to find weapons and parts among the dead.	
s5_l13_battleground_b	In addition to weapons and parts, Solomon found a bag filled with chemicals. His mind was haunted by the thought of deputies murdering one another for a long time afterward.	
s5_l14_ranch	Grim Ranch	
s5_l14_ranch_desc	The ranch appeared abandoned. A strange smell came from the barn. Solomon didn't know whether it death, madness or some other abomination.	
s5_l14_ranch_r_a	Solomon searched the barn.	g
s5_l14_ranch_r_b	Solomon scavenged the area around but didn't enter the barn itself.	g
s5_l14_ranch_a	The barn contained nearly fifty bodies. They appeared to have commited suicide together by slicing open their wrists.<br><br>Though both the stench and the scene were extreme, to his growing discomfort, the inventor found he was becoming used to these things. Sometimes he felt he even looked forward to them.<br><br>Solomon searched the bodies and recovered quite a few valuables.	
s5_l14_ranch_b	Solomon gave the barn a wide berth. Instead, he searched the house and found several items including chemicals and opium.	
s5_l15_circus	Circus of Blood	
s5_l15_circus_desc	A crowd of people watched intensely as two men fought to the death using knifes. The crowd was cheering and the sand was soaked with blood.<br><br>A man in a top hat commented on the fight in a booming voice.	
s5_l15_r_talk	Solomon talked to the announcer.	n
s5_l15_talk	Solomon approached the announcer who said his name was Daniel Mollgaard Andersen. He was an entrepreneur who had found a way to profit from the plague by way of this, the Circus of Blood.<br><br>He challenged Solomon to a wager: one of his men against one of the Persons. If his man won, Solomon would receive $50.	
s5_l15_r_confirm	Solomon accepted ([%0])	p50cash
s5_l15_confirm	Solomon chose to send one of the Persons into the pit.	
s5_l15_r_nevermind	After some consideration, he decided against it.	n
s5_l15_r_senda	Mr A. Persons.	g
s5_l15_r_sendb	Mr B. Persons.	g
s5_l15_r_sendc	Mr C. Persons.	g
s5_l15_winner	Mr Persons killed the madman quickly. Solomon collected his reward.	
s5_l15_win_wounded	Mr Persons killed the madman after a long, tiring fight. He was badly wounded, but Solomon was glad to have the money.	
s5_l15_loser	The madman was wiry and cruel, gutting Mr Persons with his shining blade. Solomon lost a good man, along with his money.	
s5_l15_end_arena	As Solomon left the arena, the crowd seemed to become consumed by bloodlust. The inventor hurried away. From a distance, he saw the whole site go up in flames.	
s5_l16_artist	Artist Hut	
s5_l16_artist_desc	The old hut stank of feces and paint. It was inhabited by Ernesto Ristola, an insane painter whom some considered a genius.<br><br>His admirers said Ristola's incomprehensible patterns hid untold secrets and obscure meanings. Only a mind clouded by Madness could understand the paintings, however. A healthy intellect would simply plunge into insanity.	
s5_l16_r_a	Solomon decided to see for himself. He admired the paintings for hours.	g
s5_l16_r_b	Solomon decided against spending time with such horrid creations.	g
s5_l16_a	After a short contemplation of the paintings, Solomon could feel his mental stability fading away. He ran from the hut.	
s5_l16_b	He found solace in this reflex. It reassured him he would not easily allow himself to go insane.	
s5_l16_stare_already	The paintings looked as insane as when Solomon last saw them.	
s5_l16_bp	Solomon found incredible beauty in Ristola's work. In fact, they inspired him to create an entirely original blueprint.	
s5_l16_no_bp	Solomon couldn't understand such a vast abyss of insanity. The Madness in his mind grew stronger, but no inspiration followed.	
s5_l17_camp	Abandoned Camp	
s5_l17_camp_desc	Solomon stumbled upon an abandoned campsite. Beside an extinguished fire pit he found Trumercliff's notes. They made little sense to him presently, but he thought they might prove useful later on.<br><br>One notebook was entitled "My rival inventors" and contained slanderous texts ridiculing other inventors such as Tim Russell, Christopher Wilson and Solomon DeLear. Amid mocking comments about his mistakes, Solomon found extensive deliberations on the senselessness of his past research.	
s5_l17_camp_r_a	Solomon decided to keep the notebook. It would motivate him toward scientific perfection.	g
s5_l17_camp_a	With the notebook in his pocket, he never forgot his past errors. Though his Madness increased, with it came scientific greatness.	
s5_l17_camp_r_b	Solomon burned the notebook. In this insane land, he didn't want to take on emotional weight he couldn't handle.	g
s5_l17_camp_b	Solomon maintaned his mental stability for the time being. Madness was a greater enemy than his past shortcomings.	
s5_l18_pharmacy	Teebken Pharmacy	
s5_l18_pharmacy_desc	A middle-aged man with his lips sewn together ran a pharmacy in the middle of nowhere. Though he never spoke a word, he seemed rational and was eager to strike a bargain.	
s5_l19_clock	The World's Clock	
s5_l19_clock_desc	Solomon met J. M. Hobie, an engineer who had developed what he called the "World's Clock". The device counted the time remaining until doomsday.<br><br>Solomon asked about the clock in detail and, seeing the dedication of the watchmaker, decided it was his duty as an inventor to help with its construction.	
s5_l19_clock_desc_b	Watchmaker J. M. Hobie devoted all his time to creating what he called the "World's Clock."<br><br>According to his ingenious contraption, doomsday would start only a couple years hence.	
s5_l19_r_ask	The watchmaker needed parts and the help of a master engineer ([%0])	p8mechanical_parts
s5_l19_help	Solomon DeLear and J. M. Hobie joined forces to create the extraordinary clock.<br><br>The gargatuan construction towered above them, measuring entropy in the air, while its indicator inevitably moved towards "Point Zero," the time it predicted the world would end.<br><br>As a token of his thanks, Hobie presented Solomon with a miniature version of his masterpiece. The device was functional and could be used in combat.	
s5_l19_help_noskill	Solomon's engineering skills were insufficient to help the watchmaker.	
s5_l20_swamp	Swamp - Trumercliff's last known location	
s5_l20_swamp_desc	The murky swamp was the last place where Trumercliff had been seen before vanishing. Curious about his fate, Solomon searched the area briefly, finding a message carved on a tree in the middle of the bog: "I'm at the edge of my sanity. The source must be close now. Heading North."	
s5_l20_swamp_new_r_dig	Solomon chewed ginseng to improve his eyesight and thoroughly searched the swamp ([%0])	p2ginseng
s5_l20_swamp_new_dig	Solomon did a thorough excavation searching for the body. While he didn't find his fellow inventor's corpse, his ginseng-enhanced eyes did notice a tube bearing Trumercliff's insignia. It contained a blueprint for a device.	
s5_l21_seer	Seer's hut	
s5_l21_seer_desc	An old seer was said to inhabit this small redwood house. Through an open door, Solomon could see a two-foot glass sphere in the middle of the room.	
s5_l21_seer_desc_b	A seer was said to inhabit this small redwood house. Through an open door, Solomon could see a two-foot glass sphere in the middle of the room next to a bony old man sitting perfectly still.	
s5_l21_pinkerton	Mr Persons advised Solomon against talking to the seer. He had heard he was a manipulative madman and that conversations with him only sent people deeper into insanity.	
s5_l21_seer_desc_2	Papa Hav the seer looked at Solomon, then indicated he should sit beside the glass sphere.	
s5_l21_r_talk	Solomon accepted the invitation.	g
s5_l21_talk	Solomon's conversation with Papa Hav veered from topic to topic. The seer spoke chaotically about a terrible future, along with an inspiring story of fate and madness. The experience left Solomon profoundly energized.	
s5_l23_trading_post	Trading Post	
s5_l23_trading_post_desc	This Indian Trading Post was a modest hut made of raw planks. Ms. Bradford ran the trade with the natives. Her wares included weapons, clothes and tobacco. The quality of her wares seemed high but so were her prices.	
s5_l24_burned_fort	Burnt Fort	
s5_l24_burned_fort_desc	The fort showed evidence of a terrible fire. Some of the walls were collapsed, the rest was a rickety mess of wood and iron. Charred bodies plastered the floor and with rancid fat and bones littered the yard.<br><br>At one edge was a scorched building that looked like an armory. The site looked profoundly insecure.	
s5_l24_r_a	Solomon's cursory search yielded only some useful parts in the yard.	g
s5_l24_r_b	Solomon decided to thoroughly check both the yard and the armory.	g
s5_l24_a	Solomon acquired useful parts, but the macabre images plagued his mind for weeks.	
s5_l24_b	While they were looting the fort, the armory collapsed, injuring Solomon's companions.	
s5_l27_derailed	Derailed Train	
s5_l27_derailed_desc	Solomon arrived at the scene of a terrible catastrophe. Inside the crashed train, sat a single conscious man, surrounded by bodies. He was covered in blood, but otherwise appeared well. He introduced himself as James Scheffler and assured Solomon that he had once been a doctor. He asked whether Solomon or his companions needed any help.	
s5_l27_r_solo	Solomon needed help ([%0])	p50cash
s5_l27_r_apers	A. Persons needed help ([%0])	p50cash
s5_l27_r_bpers	B. Persons needed help ([%0])	p50cash
s5_l27_r_cpers	C. Persons needed help ([%0])	p50cash
s5_l27_medic_cured	The doctor gave his patient a strange mixture to drink. Then he opened his vein to "let the bad blood out." When he was satisfied, he patched them back up.<br><br>After about an hour, he was feeling healthy again.	
s5_l28_shaft_1	Eriksson Mineshaft	
s5_l28_shaft_1_desc	A damaged crane had once transported the platform up and down shaft.<br><br>It appeared the machine had failed while the miner - Eriksson - was riding up with a pan full of golden nuggets. He would have been killed instantly.	
s5_l28_shaft_1_r_a	Solomon realized that with a few parts, he could repair the crane and retrieve the gold ([%0])	p4mechanical_parts
s5_l28_shaft_1_a	The crane was soon restored to working order and Solomon retrieved the gold. He left the crane intact, so it could be used once Madness had been banished from the land.	
s5_l28_shaft_1_a_noitems	Unfortunately, Solomon didn't have the parts to fix the crane.	
s5_l28_shaft_3	Heldelanse Mineshaft	
s5_l28_shaft_3_desc	Solomon saw a glimmer of golden light at the bottom of the shaft. Perhaps a madman had thrown his possessions down the hole?<br><br>Unfortunately, he could see no way down.	
s5_l28_shaft_3_r_a	Solomon ordered one of the Pinkertons to climb down.	g
s5_l28_shaft_3_r_b	Solomon built a simple ladder ([%0])	p3mechanical_parts
s5_l28_shaft_3_a	The Pinkerton obeyed and descended into the shaft.<br><br>As he approached the bottom, however, he slipped and injured his leg.<br><br>Luckily his colleagues were able to help him climb back up with the valuables.	
s5_l28_shaft_3_b	Solomon built a rudimentary ladder that allowed him to safely retrieve the valuables from the bottom of the shaft. Unfortunately it wasn't durable enough to last beyond this venture.	
s5_l28_shaft_3_b_noitems	Unfortunately, Solomon didn't have the parts he needed to create a ladder.	
s5_l31_fatetrader	Fate Trader	
s5_l31_fatetrader_desc	Solomon encountered a toothless dwarf who seemed to have gone completely mad. The merchant kept asking him whether he wanted to buy "scraps of fate". Despite his appearance, he had a few genuinely remarkable items for sale.	
s5_l32_oasis	Arcadian Orchard	
s5_l32_oasis_desc	Solomon came into a place that didn't seem to fit with this broken land. Gorgeous fruit trees filled an orchard, crates of fresh produce lay in easy reach, seemingly inviting anyone to taste their sweetness. Could it be real?	
s5_l32_oasis_r_a	Solomon traveled to the orchard, hoping to rest a while and recuperate.	g
s5_l32_oasis_r_b	Solomon dismissed it as a mirage.	g
s5_l32_oasis_a_insanity	Solomon's party were soon gorging themselves on ripe fruit. The water in the nearby stream was clear and cool. They found chilled liquor and gold in nearby boxes. El Dorado Pequeno, they name it. It felt like a dream come true.<br><br>The next morning, it had disappeared. And while the gold was real enough, Solomon couldn't help thinking their minds must have been permanently affected by this oddity.	
s5_l32_oasis_a_sanity	Solomon never returned there and never learned whether his suspicions had been correct.	
s5_l32_oasis_b	Soon Solomon realized it was only a mirage. The orchard was just a pack of withering trees, grim testimony that desperate minds will warp anything to gain a moment of respite.	
s5_cp2_safe3b	I believed that by using the modern, objective principles of science, I could devise a method to erase this Madness. But as I come closer to a cure, I can feel my mind slipping away. I fear I may not be able to complete my work.<br><br>The notes in this safe comprise everything I have learned thus far. For the sake of your fellow man, finish what I have started. Cure this madness. You are the only one left with the ingenuity required to accomplish this herculean feat of intellect.<br><br>- Sincerely: Trumercliff	